{
  "$schema": "https://json-schema.org/draft/2020-12/schema",
  "$id": "https://charness.corca.ai/schemas/bounded-review-result.v1.json",
  "title": "Charness bounded review result",
  "type": "object",
  "additionalProperties": false,
  "required": [
    "kind",
    "lens",
    "packet_sha256",
    "reviewed_input_identity_sha256",
    "verdict",
    "findings",
    "counterweight_triage",
    "next_move",
    "non_claims",
    "capability_non_claims",
    "capability_non_claims_sha256"
  ],
  "properties": {
    "kind": {
      "type": "string",
      "const": "charness.bounded_review.v1"
    },
    "lens": {
      "type": "string",
      "minLength": 1
    },
    "packet_sha256": {
      "type": "string",
      "pattern": "^[0-9a-f]{64}$"
    },
    "reviewed_input_identity_sha256": {
      "type": "string",
      "pattern": "^[0-9a-f]{64}$"
    },
    "verdict": {
      "type": "string",
      "enum": ["pass", "block", "defer"]
    },
    "target_observations": {
      "type": ["array", "null"],
      "description": "Per-target behavioral observations for packet prepared_targets. Use null when the packet has no structured targets; never invent observations.",
      "items": {
        "type": "object",
        "additionalProperties": false,
        "required": ["target", "verdict", "summary", "evidence"],
        "properties": {
          "target": {"type": "string", "minLength": 1},
          "verdict": {"type": "string", "enum": ["pass", "block", "defer"]},
          "summary": {"type": "string", "minLength": 1},
          "evidence": {
            "type": "array",
            "minItems": 1,
            "items": {"type": "string", "minLength": 1}
          }
        }
      }
    },
    "findings": {
      "type": "array",
      "items": {
        "type": "object",
        "additionalProperties": false,
        "required": ["id", "severity", "summary", "evidence", "action"],
        "properties": {
          "id": {"type": "string", "minLength": 1},
          "severity": {"type": "string", "minLength": 1},
          "summary": {"type": "string", "minLength": 1},
          "evidence": {"type": "array", "items": {"type": "string"}},
          "action": {"type": "string", "minLength": 1}
        }
      }
    },
    "counterweight_triage": {
      "type": "array",
      "items": {
        "type": "object",
        "additionalProperties": false,
        "required": ["concern", "bin", "disposition"],
        "properties": {
          "concern": {"type": "string", "minLength": 1},
          "bin": {"type": "string", "minLength": 1},
          "disposition": {"type": "string", "minLength": 1}
        }
      }
    },
    "next_move": {
      "type": "string",
      "minLength": 1
    },
    "non_claims": {
      "type": "array",
      "items": {"type": "string", "minLength": 1}
    },
    "capability_non_claims": {
      "type": "array",
      "items": {
        "type": "object",
        "additionalProperties": false,
        "required": [
          "logical_target",
          "disposition",
          "scope",
          "statement",
          "identity_sha256"
        ],
        "properties": {
          "logical_target": {"type": "string", "minLength": 1},
          "disposition": {"type": "string", "enum": ["unavailable", "unproved"]},
          "scope": {"type": "string", "const": "external-read-evidence"},
          "statement": {"type": "string", "minLength": 1},
          "identity_sha256": {"type": "string", "pattern": "^[0-9a-f]{64}$"}
        }
      }
    },
    "capability_non_claims_sha256": {
      "type": "string",
      "pattern": "^[0-9a-f]{64}$"
    }
  }
}
