{
  "kind": "charness.bounded_review.v1",
  "lens": "code-critique",
  "packet_sha256": "6862e711cca4d7ffe07efb1ab52f5ead8af14da25c4110b3f3c427cbe4fccd86",
  "reviewed_input_identity_sha256": "aec251e1697cce17131e74e57bd642b7ab9f7082d74e82321d2f05e8f3f88b78",
  "verdict": "block",
  "target_observations": null,
  "findings": [
    {
      "id": "progress-stop-reason-not-merged",
      "severity": "medium",
      "summary": "A no-progress stop can lose its typed blocker from lane_progress and the actionable next step when appending the transcript marker fails.",
      "evidence": [
        "scripts/task_run/task_run_progress.py: LaneProgressWatch._run assigns stop_reason before calling fire(), and deliberately survives any exception from fire().",
        "scripts/task_run/task_run_progress.py: LaneProgressWatch.fire() may fail to append NO-PROGRESS-STOP but still invokes the kill callback.",
        "scripts/task_run/task_run_lane_runner.py: apply_lane_receipt() derives blocker only from parsed delivery/stderr and merges only guard phases; it does not accept or merge progress_guard.stop_reason.",
        "tests/charness_cli/test_task_run_implementation_lane.py: test_watch_run_records_stop_before_failing_fire proves stop_reason survives a failed fire, but no completion-level test proves that this reason reaches lane_progress or blockers.",
        "docs/agent-task-runs.md claims a guard-killed lane is recorded with a typed NO-PROGRESS-STOP blocker; the failure path instead retains the reason only under progress_guard and can produce merely a generic execution failure downstream."
      ],
      "action": "Pass the guard stop reason into apply_lane_receipt(), use it as the blocker when transcript parsing has none, and add an integration test covering failed marker persistence through completion, lane_progress, blockers, and next_step."
    }
  ],
  "counterweight_triage": [
    {
      "concern": "The progress watcher, prompt shaping, state derivation, completion proof, and retention logic are split across several modules.",
      "bin": "not-blocking",
      "disposition": "The boundaries are cohesive: live observation is isolated in task_run_progress, runner-facing prompt and receipt assembly in task_run_lane_runner, pure state derivation in task_run_state, and proof/retention orchestration in task_run_completion."
    },
    {
      "concern": "The bounded stderr tail can omit early phase markers.",
      "bin": "addressed",
      "disposition": "The live watcher accumulates phases and completion merges guard-observed phases in canonical order; tests cover markers aging out of the tail."
    },
    {
      "concern": "A gate-mutated but freshly committed candidate may have its worktree released despite approval denial.",
      "bin": "intentional",
      "disposition": "The documentation explicitly permits release when a fresh complete commit carries the candidate even though proof denied approval, and the receipt remains ineligible."
    }
  ],
  "next_move": "Repair the missing stop-reason merge and add the completion-level regression test before approval; then rerun the focused task-run tests and declared Python/docs/package validators.",
  "non_claims": [
    "This review does not claim that repository validators or tests were executed.",
    "This review does not assess files outside the eight identity-bound semantic inputs.",
    "This review does not infer application of the requested reviewer model, effort, or service tier.",
    "This review is not goal-bound."
  ],
  "capability_non_claims": [],
  "capability_non_claims_sha256": "4f53cda18c2baa0c0354bb5f9a3ecbe5ed12ab4d8e11ba873c2f11161202b945"
}
